{
  "$schema": "https://json-schema.org/draft/2020-12/schema",
  "title": "ReadStack Ed25519 policy envelope v1",
  "description": "The App enforces a 786432-byte UTF-8 envelope limit and authenticates decoded payload bytes against an independently configured 32-byte public key. A matching schema is not evidence of a valid signature.",
  "type": "object",
  "additionalProperties": false,
  "required": ["schemaVersion", "keyId", "payload", "signature"],
  "properties": {
    "schemaVersion": {"const": 1},
    "keyId": {
      "type": "string",
      "minLength": 1,
      "maxLength": 64,
      "pattern": "^[A-Za-z0-9][A-Za-z0-9._-]{0,63}$"
    },
    "payload": {
      "type": "string",
      "minLength": 4,
      "maxLength": 699052,
      "pattern": "^(?:[A-Za-z0-9+/]{4})*(?:[A-Za-z0-9+/]{2}==|[A-Za-z0-9+/]{3}=)?$",
      "description": "Canonical standard base64 of the complete, nonempty payload UTF-8 bytes; no base64url or whitespace. Decoded payload is at most 524288 bytes."
    },
    "signature": {
      "type": "string",
      "minLength": 88,
      "maxLength": 88,
      "pattern": "^[A-Za-z0-9+/]{85}[AQgw]==$",
      "description": "Canonical standard base64 of exactly 64 Ed25519 signature bytes."
    }
  }
}
