{"schemaVersion":1,"keyId":"readstack-policy-2026-10-k1","payload":"ewogICJzY2hlbWFWZXJzaW9uIjogMSwKICAicHVycG9zZSI6ICJyZWFkc3RhY2stY29udGVudC1yZXN0cmljdGlvbnMiLAogICJzb3VyY2UiOiAiaHR0cHM6Ly9hcGkuZ2l0aHViLmNvbS9yZXBvcy9HZVBlbmd1aW4vcmVhZHN0YWNrLXBvbGljeS9jb250ZW50cy9wb2xpY3kvcmVzdHJpY3Rpb25zLnNpZ25lZC5qc29uP3JlZj1tYWluIiwKICAibWFuaWZlc3QiOiB7CiAgICAic2NoZW1hVmVyc2lvbiI6IDEsCiAgICAicmV2aXNpb24iOiAyLAogICAgInJ1bGVzIjogW10sCiAgICAicmV2b2tlZFJ1bGVJZHMiOiBbXQogIH0KfQo=","signature":"3pmK/bsrgtllhHRuRA4CnWoP98FOfAfGpSuEks4xdSyXk2cGgY42Lvfn+LipdCQ4MYqrBYaAknEGI86oH7e7Bg=="}
